{
  "$schema": "https://ansldes.dev/schema/design-system-definition.v2.json",
  "schemaVersion": 2,
  "id": "example-product",
  "version": "1.0.0",
  "themes": {
    "names": ["light", "dark"],
    "default": "light"
  },
  "foundations": {
    "color": {
      "primitive": {
        "neutral.0": "#FFFFFF",
        "neutral.900": "#18202A",
        "accent.500": "#4263EB"
      },
      "semantic": {
        "text.primary": {
          "light": "{color.primitive.neutral.900}",
          "dark": "{color.primitive.neutral.0}"
        },
        "action.primary": {
          "light": "{color.primitive.accent.500}",
          "dark": "{color.primitive.accent.500}"
        },
        "action.primary-pressed": {
          "light": "{color.primitive.neutral.900}",
          "dark": "{color.primitive.neutral.0}"
        },
        "surface.disabled": {
          "light": "{color.primitive.neutral.0}",
          "dark": "{color.primitive.neutral.900}"
        },
        "text.disabled": {
          "light": "{color.primitive.neutral.900}",
          "dark": "{color.primitive.neutral.0}"
        },
        "text.secondary": {
          "light": "{color.primitive.neutral.900}",
          "dark": "{color.primitive.neutral.0}"
        },
        "surface.field": {
          "light": "{color.primitive.neutral.0}",
          "dark": "{color.primitive.neutral.900}"
        },
        "surface.subtle": {
          "light": "{color.primitive.neutral.0}",
          "dark": "{color.primitive.neutral.900}"
        },
        "border.default": {
          "light": "{color.primitive.neutral.900}",
          "dark": "{color.primitive.neutral.0}"
        },
        "status.danger": {
          "light": "{color.primitive.neutral.900}",
          "dark": "{color.primitive.neutral.0}"
        },
        "border.focus": {
          "light": "{color.primitive.accent.500}",
          "dark": "{color.primitive.accent.500}"
        },
        "border.transparent": {
          "light": "{color.primitive.neutral.0}",
          "dark": "{color.primitive.neutral.900}"
        }
      },
      "component": {
        "button.primary.container": "{color.semantic.action.primary}",
        "button.primary.label": "{color.semantic.text.primary}",
        "button.disabled.container": "{color.semantic.surface.disabled}",
        "button.disabled.label": "{color.semantic.text.disabled}",
        "recipe.border.focus": "{color.semantic.border.focus}",
        "recipe.border.transparent": "{color.semantic.border.transparent}",
        "recipe.action.primary-pressed": "{color.semantic.action.primary-pressed}",
        "recipe.surface.disabled": "{color.semantic.surface.disabled}",
        "recipe.text.disabled": "{color.semantic.text.disabled}",
        "recipe.status.danger": "{color.semantic.status.danger}",
        "recipe.border.default": "{color.semantic.border.default}",
        "recipe.text.secondary": "{color.semantic.text.secondary}",
        "recipe.surface.field": "{color.semantic.surface.field}",
        "recipe.text.primary": "{color.semantic.text.primary}",
        "recipe.action.primary": "{color.semantic.action.primary}",
        "recipe.surface.subtle": "{color.semantic.surface.subtle}"
      },
      "asset": {}
    },
    "spacing": {
      "primitive": {
        "0": 0,
        "2": 8,
        "4": 16
      },
      "semantic": {
        "control.gap": "{spacing.primitive.2}",
        "control.vertical": "{spacing.primitive.2}",
        "component.button.horizontal": "{spacing.primitive.4}",
        "component.control.horizontal": "{spacing.primitive.4}"
      },
      "component": {
        "button.horizontal": "{spacing.semantic.component.button.horizontal}",
        "control.horizontal": "{spacing.semantic.component.control.horizontal}",
        "recipe.control.gap": "{spacing.semantic.control.gap}",
        "recipe.control.vertical": "{spacing.semantic.control.vertical}"
      }
    },
    "radius": {
      "primitive": {
        "none": 0,
        "medium": 12
      },
      "semantic": {
        "control": "{radius.primitive.medium}"
      },
      "component": {
        "button": "{radius.semantic.control}",
        "control": "{radius.semantic.control}",
        "surface": "{radius.semantic.control}"
      }
    },
    "size": {
      "primitive": {
        "touch-target": 44,
        "control": 52
      },
      "semantic": {
        "control.minimum": "{size.primitive.touch-target}",
        "component.button.medium": "{size.primitive.control}",
        "component.control.medium": "{size.primitive.control}",
        "component.list.two-line": "{size.primitive.control}"
      },
      "component": {
        "button.medium": "{size.semantic.component.button.medium}",
        "control.medium": "{size.semantic.component.control.medium}",
        "list.two-line": "{size.semantic.component.list.two-line}",
        "recipe.control.minimum": "{size.semantic.control.minimum}"
      }
    },
    "typography": {
      "familyName": "Example Sans",
      "weights": {
        "regular": {
          "fontFamily": "ExampleSans-Regular",
          "fontWeight": 400
        },
        "bold": {
          "fontFamily": "ExampleSans-Bold",
          "fontWeight": 700
        }
      },
      "tokens": {
        "body.medium": {
          "fontSize": 16,
          "lineHeight": 24,
          "maxFontSizeMultiplier": 2.35,
          "allowedWeights": ["regular", "bold"],
          "category": "core",
          "functionalTextAllowed": true
        }
      },
      "roles": {
        "button.label": {
          "visualToken": "body.medium",
          "weight": "bold"
        },
        "field.label": {
          "visualToken": "body.medium",
          "weight": "bold"
        },
        "field.input": {
          "visualToken": "body.medium",
          "weight": "regular"
        },
        "supporting.text": {
          "visualToken": "body.medium",
          "weight": "regular"
        },
        "selection.label": {
          "visualToken": "body.medium",
          "weight": "bold"
        },
        "list.label": {
          "visualToken": "body.medium",
          "weight": "bold"
        },
        "feedback.title": {
          "visualToken": "body.medium",
          "weight": "bold"
        }
      }
    },
    "motion": {
      "durations": {
        "instant": 0,
        "fast": 160
      },
      "easings": {
        "standard": [0.2, 0, 0, 1]
      },
      "transitions": {
        "control.press": {
          "duration": "{motion.duration.fast}",
          "easing": "{motion.easing.standard}",
          "reducedMotion": {
            "duration": "{motion.duration.instant}",
            "fallback": "instant"
          }
        }
      }
    },
    "elevation": {
      "flat": {
        "level": 0
      },
      "raised": {
        "level": 1
      }
    },
    "layer": {
      "semantic": {
        "content": 0,
        "overlay": 100
      },
      "component": {
        "modal": 100
      }
    },
    "icon": {
      "sizes": {
        "small": 16,
        "medium": 20
      },
      "strokes": {
        "regular": 2
      },
      "opticalAlignments": {
        "center": {
          "x": 0,
          "y": 0
        }
      },
      "icons": {
        "arrow-right": {
          "viewBox": [0, 0, 24, 24],
          "geometry": [
            {
              "kind": "path",
              "d": "M5 12h14M13 6l6 6-6 6",
              "fill": "none",
              "stroke": "current",
              "strokeWidth": "regular"
            }
          ],
          "defaultSize": "medium",
          "allowedSizes": ["small", "medium"],
          "opticalAlignment": "center"
        }
      },
      "usages": {
        "navigation.next": {
          "icon": "arrow-right",
          "size": "medium",
          "purpose": "disclosure"
        }
      },
      "actions": {
        "navigation.forward": {
          "icon": "arrow-right",
          "size": "medium",
          "label": "Continue"
        }
      }
    }
  },
  "components": {
    "button": {
      "anatomy": ["root", "label", "leading-icon", "trailing-icon"],
      "slots": {
        "contentGap": "{spacing.component.recipe.control.gap}",
        "disabledContainer": "{color.component.button.disabled.container}",
        "disabledLabel": "{color.component.button.disabled.label}",
        "focusBorder": "{color.component.recipe.border.focus}",
        "focusBorderWidth": 2,
        "idleBorder": "{color.component.recipe.border.transparent}"
      },
      "variants": {
        "primary": {
          "container": "{color.component.button.primary.container}",
          "label": "{color.component.button.primary.label}",
          "pressedContainer": "{color.component.recipe.action.primary-pressed}",
          "pressedOpacity": 1,
          "radius": "{radius.component.button}"
        }
      },
      "sizes": {
        "medium": {
          "minHeight": "{size.component.button.medium}",
          "horizontalPadding": "{spacing.component.button.horizontal}",
          "verticalPadding": "{spacing.component.recipe.control.vertical}",
          "typographyRole": "{typography.role.button.label}"
        }
      },
      "states": ["default", "pressed", "disabled", "loading", "focused"],
      "semantics": {
        "role": "button",
        "minimumTarget": "{size.component.recipe.control.minimum}"
      }
    },
    "textField": {
      "anatomy": ["root", "label", "input", "message"],
      "slots": {
        "disabledContainer": "{color.component.recipe.surface.disabled}",
        "disabledText": "{color.component.recipe.text.disabled}",
        "errorBorder": "{color.component.recipe.status.danger}",
        "errorText": "{color.component.recipe.status.danger}",
        "focusBorder": "{color.component.recipe.border.focus}",
        "focusBorderWidth": 2,
        "idleBorder": "{color.component.recipe.border.default}",
        "idleBorderWidth": 1,